{
    "mpi": {
        "command": "mpirun",
        "ranks": "4",
        "configuration": "--allow-run-as-root --oversubscribe"
    },
    "vol": {
        "library": "/vol-async/src:/hdf5-async-vol-register-install/lib:/argobots/install/lib:/hdf5-install/install:",
        "path": "/vol-async/src",
        "connector": "async under_vol=0;under_info={}"
    },
    "file-system": {

    },
    "directory": "storage",
    "benchmarks": [
        {
            "benchmark": "write",
            "file": "test.h5",
            "configuration": {
                "MEM_PATTERN": "CONTIG",
                "FILE_PATTERN": "CONTIG",
                "TIMESTEPS": "5",
                "DELAYED_CLOSE_TIMESTEPS": "2",
                "COLLECTIVE_DATA": "NO",
                "COLLECTIVE_METADATA": "NO",
                "EMULATED_COMPUTE_TIME_PER_TIMESTEP": "5 s", 
                "NUM_DIMS": "1",
                "DIM_1": "16777216",
                "DIM_2": "1",
                "DIM_3": "1",
                "MODE": "ASYNC",
                "CSV_FILE": "output.csv"
            }
        },
        {
            "benchmark": "read",
            "file": "test.h5",
            "configuration": {
                "MEM_PATTERN": "CONTIG",
                "FILE_PATTERN": "CONTIG",
                "TIMESTEPS": "5",
                "DELAYED_CLOSE_TIMESTEPS": "2",
                "COLLECTIVE_DATA": "NO",
                "COLLECTIVE_METADATA": "NO",
                "EMULATED_COMPUTE_TIME_PER_TIMESTEP": "5 s", 
                "NUM_DIMS": "1",
                "DIM_1": "16777216",
                "DIM_2": "1",
                "DIM_3": "1",
                "MODE": "ASYNC",
                "CSV_FILE": "output.csv"
            }
        }
    ]
}
