{
    "mpi": {
        "command": "mpirun",
        "ranks": "4",
        "configuration": "--allow-run-as-root -n 2 --oversubscribe"
    },
    "vol": {
    },
    "file-system": {
    },
    "directory": "storage",
    "benchmarks": [
        {
            "benchmark": "write_var_normal_dist",
            "file": "test.h5",
            "configuration": {
                "MEM_PATTERN": "CONTIG",
                "FILE_PATTERN": "CONTIG",
                "TIMESTEPS": "5",
                "DELAYED_CLOSE_TIMESTEPS": "2",
                "COLLECTIVE_DATA": "YES",
                "COLLECTIVE_METADATA": "YES",
                "EMULATED_COMPUTE_TIME_PER_TIMESTEP": "1 s",
                "NUM_DIMS": "1",
                "DIM_1": "524288",
                "STDEV_DIM_1": "100000",
                "DIM_2": "1",
                "DIM_3": "1",
                "CSV_FILE": "output.csv",
                "MODE": "SYNC"
            }
        }
    ]
}
