{
    "mpi": {
        "command": "mpirun",
        "ranks": "4",
        "configuration": "--allow-run-as-root --oversubscribe"
    },
    "vol": {
        
    },
    "file-system": {

    },
    "directory": "storage",
    "benchmarks": [
        {
            "benchmark": "exerciser",
            "configuration": {
                "numdims": "2",
                "minels": "8 8",
                "nsizes": "3",
                "bufmult": "2 2",
                "dimranks": "8 4"
            }
        }
    ]
}