{
    "mpi": {
        "command": "mpirun",
        "ranks": "4",
        "configuration": "--allow-run-as-root --oversubscribe --np 4"
    },
    "vol": {
        
    },
    "file-system": {

    },
    "directory": "storage",
    "benchmarks": [
        {
            "benchmark": "metadata",
            "file": "hdf5_iotest.h5",
            "configuration": {
                "version": "0",
                "steps": "20",
                "arrays": "500",
                "rows": "100",
                "columns": "200",
                "process-rows": "2",
                "process-columns": "2",
                "scaling": "weak",
                "dataset-rank": "4",
                "slowest-dimension": "step",
                "layout": "contiguous",
                "mpi-io": "independent",       
                "csv-file": "hdf5_iotest.csv"
            }
        }
    ]
}