{
    "mpi": {
        "command": "mpirun",
        "ranks": "4",
        "configuration": "--allow-run-as-root --oversubscribe -np 8"
    },
    "vol": {
        "library": "/vol-async/src:/hdf5-async-vol-register-install/lib:/argobots/install/lib:/hdf5-install/install:",
        "path": "/vol-async/src",
        "connector": "async under_vol=0;under_info={}"
    },
    "file-system": {

    },
    "directory": "storage",
    "benchmarks": [
        {
            "benchmark": "amrex",
            "file": "amrex",
            "configuration": {
                "ncells": "64",
                "max_grid_size": "8",
                "nlevs": "1",
                "ncomp": "6",
                "nppc": "2",
                "nplotfile": "2",
                "nparticlefile": "2",
                "sleeptime": "2",
                "restart_check": "1",
                "mode": "ASYNC"
            }
        }
    ]
}