{
    "mpi": {
        "command": "mpirun",
        "ranks": "4",
        "configuration": "--allow-run-as-root --np 2 --oversubscribe"
    },
    "vol": {
    },
    "file-system": {
    },
    "directory": "storage",
    "benchmarks": [
        {
            "benchmark": "write",
            "file": "test.h5",
            "configuration": {
                "MEM_PATTERN": "CONTIG",
                "FILE_PATTERN": "STRIDED",
                "TIMESTEPS": "5",
                "DELAYED_CLOSE_TIMESTEPS": "2",
                "COLLECTIVE_DATA": "YES",
                "COLLECTIVE_METADATA": "YES",
                "EMULATED_COMPUTE_TIME_PER_TIMESTEP": "1 s", 
                "NUM_DIMS": "1",
                "DIM_1": "4194304",
                "DIM_2": "1",
                "DIM_3": "1",
                "STRIDE_SIZE": "2",
                "BLOCK_SIZE": "2",
                "BLOCK_CNT": "1048576",
                "CSV_FILE": "output.csv",
                "MODE": "SYNC"
            }
        }
    ]
}